Id,text
0,"The Project Gutenberg eBook of Alice’s Adventures in Wonderland, by Lewis CarrollThis eBook is for the use of anyone anywhere in the United States andmost other parts of the world at no cost and with almost no restrictionswhatsoever"
1," You may copy it, give it away or re-use it under the termsof the Project Gutenberg License included with this eBook or online atwww"
2,gutenberg
3,org
4," If you are not located in the United States, youwill have to check the laws of the country where you are located beforeusing this eBook"
5,"Title: Alice’s Adventures in WonderlandAuthor: Lewis CarrollRelease Date: January, 1991 [eBook #11][Most recently updated: October 12, 2020]Language: EnglishCharacter set encoding: UTF-8Produced by: Arthur DiBianca and David Widger*** START OF THE PROJECT GUTENBERG EBOOK ALICE’S ADVENTURES IN WONDERLAND ***[Illustration]Alice’s Adventures in Wonderlandby Lewis CarrollTHE MILLENNIUM FULCRUM EDITION 3"
6,0Contents CHAPTER I
7,     Down the Rabbit-Hole CHAPTER II
8,    The Pool of Tears CHAPTER III
9,   A Caucus-Race and a Long Tale CHAPTER IV
10,    The Rabbit Sends in a Little Bill CHAPTER V
11,     Advice from a Caterpillar CHAPTER VI
12,    Pig and Pepper CHAPTER VII
13,   A Mad Tea-Party CHAPTER VIII
14,  The Queen’s Croquet-Ground CHAPTER IX
15,    The Mock Turtle’s Story CHAPTER X
16,     The Lobster Quadrille CHAPTER XI
17,    Who Stole the Tarts? CHAPTER XII
18,   Alice’s EvidenceCHAPTER I
19,"Down the Rabbit-HoleAlice was beginning to get very tired of sitting by her sister on thebank, and of having nothing to do: once or twice she had peeped intothe book her sister was reading, but it had no pictures orconversations in it, “and what is the use of a book,” thought Alice“without pictures or conversations?”So she was considering in her own mind (as well as she could, for thehot day made her feel very sleepy and stupid), whether the pleasure ofmaking a daisy-chain would be worth the trouble of getting up andpicking the daisies, when suddenly a White Rabbit with pink eyes ranclose by her"
20,"There was nothing so _very_ remarkable in that; nor did Alice think itso _very_ much out of the way to hear the Rabbit say to itself, “Ohdear! Oh dear! I shall be late!” (when she thought it over afterwards,it occurred to her that she ought to have wondered at this, but at thetime it all seemed quite natural); but when the Rabbit actually _took awatch out of its waistcoat-pocket_, and looked at it, and then hurriedon, Alice started to her feet, for it flashed across her mind that shehad never before seen a rabbit with either a waistcoat-pocket, or awatch to take out of it, and burning with curiosity, she ran across thefield after it, and fortunately was just in time to see it pop down alarge rabbit-hole under the hedge"
21,"In another moment down went Alice after it, never once considering howin the world she was to get out again"
22,"The rabbit-hole went straight on like a tunnel for some way, and thendipped suddenly down, so suddenly that Alice had not a moment to thinkabout stopping herself before she found herself falling down a verydeep well"
23,"Either the well was very deep, or she fell very slowly, for she hadplenty of time as she went down to look about her and to wonder whatwas going to happen next"
24," First, she tried to look down and make outwhat she was coming to, but it was too dark to see anything; then shelooked at the sides of the well, and noticed that they were filled withcupboards and book-shelves; here and there she saw maps and pictureshung upon pegs"
25," She took down a jar from one of the shelves as shepassed; it was labelled “ORANGE MARMALADE”, but to her greatdisappointment it was empty: she did not like to drop the jar for fearof killing somebody underneath, so managed to put it into one of thecupboards as she fell past it"
26,"“Well!” thought Alice to herself, “after such a fall as this, I shallthink nothing of tumbling down stairs! How brave they’ll all think meat home! Why, I wouldn’t say anything about it, even if I fell off thetop of the house!” (Which was very likely true"
27,")Down, down, down"
28, Would the fall _never_ come to an end? “I wonder howmany miles I’ve fallen by this time?” she said aloud
29, “I must begetting somewhere near the centre of the earth
30," Let me see: that wouldbe four thousand miles down, I think—” (for, you see, Alice had learntseveral things of this sort in her lessons in the schoolroom, andthough this was not a _very_ good opportunity for showing off herknowledge, as there was no one to listen to her, still it was goodpractice to say it over) “—yes, that’s about the right distance—butthen I wonder what Latitude or Longitude I’ve got to?” (Alice had noidea what Latitude was, or Longitude either, but thought they were nicegrand words to say"
31,)Presently she began again
32," “I wonder if I shall fall right _through_the earth! How funny it’ll seem to come out among the people that walkwith their heads downward! The Antipathies, I think—” (she was ratherglad there _was_ no one listening, this time, as it didn’t sound at allthe right word) “—but I shall have to ask them what the name of thecountry is, you know"
33," Please, Ma’am, is this New Zealand or Australia?”(and she tried to curtsey as she spoke—fancy _curtseying_ as you’refalling through the air! Do you think you could manage it?) “And whatan ignorant little girl she’ll think me for asking! No, it’ll never doto ask: perhaps I shall see it written up somewhere"
34,"”Down, down, down"
35," There was nothing else to do, so Alice soon begantalking again"
36," “Dinah’ll miss me very much to-night, I should think!”(Dinah was the cat"
37,) “I hope they’ll remember her saucer of milk attea-time
38," Dinah my dear! I wish you were down here with me! There areno mice in the air, I’m afraid, but you might catch a bat, and that’svery like a mouse, you know"
39," But do cats eat bats, I wonder?” And hereAlice began to get rather sleepy, and went on saying to herself, in adreamy sort of way, “Do cats eat bats? Do cats eat bats?” andsometimes, “Do bats eat cats?” for, you see, as she couldn’t answereither question, it didn’t much matter which way she put it"
40," She feltthat she was dozing off, and had just begun to dream that she waswalking hand in hand with Dinah, and saying to her very earnestly,“Now, Dinah, tell me the truth: did you ever eat a bat?” when suddenly,thump! thump! down she came upon a heap of sticks and dry leaves, andthe fall was over"
41,"Alice was not a bit hurt, and she jumped up on to her feet in a moment:she looked up, but it was all dark overhead; before her was anotherlong passage, and the White Rabbit was still in sight, hurrying downit"
42," There was not a moment to be lost: away went Alice like the wind,and was just in time to hear it say, as it turned a corner, “Oh my earsand whiskers, how late it’s getting!” She was close behind it when sheturned the corner, but the Rabbit was no longer to be seen: she foundherself in a long, low hall, which was lit up by a row of lamps hangingfrom the roof"
43,"There were doors all round the hall, but they were all locked; and whenAlice had been all the way down one side and up the other, trying everydoor, she walked sadly down the middle, wondering how she was ever toget out again"
44,"Suddenly she came upon a little three-legged table, all made of solidglass; there was nothing on it except a tiny golden key, and Alice’sfirst thought was that it might belong to one of the doors of the hall;but, alas! either the locks were too large, or the key was too small,but at any rate it would not open any of them"
45," However, on the secondtime round, she came upon a low curtain she had not noticed before, andbehind it was a little door about fifteen inches high: she tried thelittle golden key in the lock, and to her great delight it fitted!Alice opened the door and found that it led into a small passage, notmuch larger than a rat-hole: she knelt down and looked along thepassage into the loveliest garden you ever saw"
46," How she longed to getout of that dark hall, and wander about among those beds of brightflowers and those cool fountains, but she could not even get her headthrough the doorway; “and even if my head would go through,” thoughtpoor Alice, “it would be of very little use without my shoulders"
47," Oh,how I wish I could shut up like a telescope! I think I could, if I onlyknew how to begin"
48,"” For, you see, so many out-of-the-way things hadhappened lately, that Alice had begun to think that very few thingsindeed were really impossible"
49,"There seemed to be no use in waiting by the little door, so she wentback to the table, half hoping she might find another key on it, or atany rate a book of rules for shutting people up like telescopes: thistime she found a little bottle on it, (“which certainly was not herebefore,” said Alice,) and round the neck of the bottle was a paperlabel, with the words “DRINK ME,” beautifully printed on it in largeletters"
50,"It was all very well to say “Drink me,” but the wise little Alice wasnot going to do _that_ in a hurry"
51," “No, I’ll look first,” she said,“and see whether it’s marked ‘_poison_’ or not”; for she had readseveral nice little histories about children who had got burnt, andeaten up by wild beasts and other unpleasant things, all because they_would_ not remember the simple rules their friends had taught them:such as, that a red-hot poker will burn you if you hold it too long;and that if you cut your finger _very_ deeply with a knife, it usuallybleeds; and she had never forgotten that, if you drink much from abottle marked “poison,” it is almost certain to disagree with you,sooner or later"
52,"However, this bottle was _not_ marked “poison,” so Alice ventured totaste it, and finding it very nice, (it had, in fact, a sort of mixedflavour of cherry-tart, custard, pine-apple, roast turkey, toffee, andhot buttered toast,) she very soon finished it off"
53,*      *      *      *      *      *      *    *      *      *      *      *      **      *      *      *      *      *      *“What a curious feeling!” said Alice; “I must be shutting up like atelescope
54,"”And so it was indeed: she was now only ten inches high, and her facebrightened up at the thought that she was now the right size for goingthrough the little door into that lovely garden"
55," First, however, shewaited for a few minutes to see if she was going to shrink any further:she felt a little nervous about this; “for it might end, you know,”said Alice to herself, “in my going out altogether, like a candle"
56," Iwonder what I should be like then?” And she tried to fancy what theflame of a candle is like after the candle is blown out, for she couldnot remember ever having seen such a thing"
57,"After a while, finding that nothing more happened, she decided on goinginto the garden at once; but, alas for poor Alice! when she got to thedoor, she found she had forgotten the little golden key, and when shewent back to the table for it, she found she could not possibly reachit: she could see it quite plainly through the glass, and she tried herbest to climb up one of the legs of the table, but it was too slippery;and when she had tired herself out with trying, the poor little thingsat down and cried"
58,"“Come, there’s no use in crying like that!” said Alice to herself,rather sharply; “I advise you to leave off this minute!” She generallygave herself very good advice, (though she very seldom followed it),and sometimes she scolded herself so severely as to bring tears intoher eyes; and once she remembered trying to box her own ears for havingcheated herself in a game of croquet she was playing against herself,for this curious child was very fond of pretending to be two people"
59,"“But it’s no use now,” thought poor Alice, “to pretend to be twopeople! Why, there’s hardly enough of me left to make _one_ respectableperson!”Soon her eye fell on a little glass box that was lying under the table:she opened it, and found in it a very small cake, on which the words“EAT ME” were beautifully marked in currants"
60," “Well, I’ll eat it,” saidAlice, “and if it makes me grow larger, I can reach the key; and if itmakes me grow smaller, I can creep under the door; so either way I’llget into the garden, and I don’t care which happens!”She ate a little bit, and said anxiously to herself, “Which way? Whichway?”, holding her hand on the top of her head to feel which way it wasgrowing, and she was quite surprised to find that she remained the samesize: to be sure, this generally happens when one eats cake, but Alicehad got so much into the way of expecting nothing but out-of-the-waythings to happen, that it seemed quite dull and stupid for life to goon in the common way"
61,"So she set to work, and very soon finished off the cake"
62,*      *      *      *      *      *      *    *      *      *      *      *      **      *      *      *      *      *      *CHAPTER II
63,"The Pool of Tears“Curiouser and curiouser!” cried Alice (she was so much surprised, thatfor the moment she quite forgot how to speak good English); “now I’mopening out like the largest telescope that ever was! Good-bye, feet!”(for when she looked down at her feet, they seemed to be almost out ofsight, they were getting so far off)"
64," “Oh, my poor little feet, Iwonder who will put on your shoes and stockings for you now, dears? I’msure _I_ shan’t be able! I shall be a great deal too far off to troublemyself about you: you must manage the best way you can;—but I must bekind to them,” thought Alice, “or perhaps they won’t walk the way Iwant to go! Let me see: I’ll give them a new pair of boots everyChristmas"
65,”And she went on planning to herself how she would manage it
66," “They mustgo by the carrier,” she thought; “and how funny it’ll seem, sendingpresents to one’s own feet! And how odd the directions will look!     _Alice’s Right Foot, Esq"
67,", Hearthrug, near the Fender,_ (_with     Alice’s love_)"
68,"Oh dear, what nonsense I’m talking!”Just then her head struck against the roof of the hall: in fact she wasnow more than nine feet high, and she at once took up the little goldenkey and hurried off to the garden door"
69,"Poor Alice! It was as much as she could do, lying down on one side, tolook through into the garden with one eye; but to get through was morehopeless than ever: she sat down and began to cry again"
70,"“You ought to be ashamed of yourself,” said Alice, “a great girl likeyou,” (she might well say this), “to go on crying in this way! Stopthis moment, I tell you!” But she went on all the same, sheddinggallons of tears, until there was a large pool all round her, aboutfour inches deep and reaching half down the hall"
71,"After a time she heard a little pattering of feet in the distance, andshe hastily dried her eyes to see what was coming"
72," It was the WhiteRabbit returning, splendidly dressed, with a pair of white kid glovesin one hand and a large fan in the other: he came trotting along in agreat hurry, muttering to himself as he came, “Oh! the Duchess, theDuchess! Oh! won’t she be savage if I’ve kept her waiting!” Alice feltso desperate that she was ready to ask help of any one; so, when theRabbit came near her, she began, in a low, timid voice, “If you please,sir—” The Rabbit started violently, dropped the white kid gloves andthe fan, and skurried away into the darkness as hard as he could go"
73,"Alice took up the fan and gloves, and, as the hall was very hot, shekept fanning herself all the time she went on talking: “Dear, dear! Howqueer everything is to-day! And yesterday things went on just as usual"
74,I wonder if I’ve been changed in the night? Let me think: was I thesame when I got up this morning? I almost think I can remember feelinga little different
75," But if I’m not the same, the next question is, Whoin the world am I? Ah, _that’s_ the great puzzle!” And she beganthinking over all the children she knew that were of the same age asherself, to see if she could have been changed for any of them"
76,"“I’m sure I’m not Ada,” she said, “for her hair goes in such longringlets, and mine doesn’t go in ringlets at all; and I’m sure I can’tbe Mabel, for I know all sorts of things, and she, oh! she knows such avery little! Besides, _she’s_ she, and _I’m_ I, and—oh dear, howpuzzling it all is! I’ll try if I know all the things I used to know"
77,"Let me see: four times five is twelve, and four times six is thirteen,and four times seven is—oh dear! I shall never get to twenty at thatrate! However, the Multiplication Table doesn’t signify: let’s tryGeography"
78," London is the capital of Paris, and Paris is the capital ofRome, and Rome—no, _that’s_ all wrong, I’m certain! I must have beenchanged for Mabel! I’ll try and say ‘_How doth the little_—’” and shecrossed her hands on her lap as if she were saying lessons, and beganto repeat it, but her voice sounded hoarse and strange, and the wordsdid not come the same as they used to do:—“How doth the little crocodile    Improve his shining tail,And pour the waters of the Nile    On every golden scale!“How cheerfully he seems to grin,    How neatly spread his claws,And welcome little fishes in    With gently smiling jaws!”“I’m sure those are not the right words,” said poor Alice, and her eyesfilled with tears again as she went on, “I must be Mabel after all, andI shall have to go and live in that poky little house, and have next tono toys to play with, and oh! ever so many lessons to learn! No, I’vemade up my mind about it; if I’m Mabel, I’ll stay down here! It’ll beno use their putting their heads down and saying ‘Come up again, dear!’I shall only look up and say ‘Who am I then? Tell me that first, andthen, if I like being that person, I’ll come up: if not, I’ll stay downhere till I’m somebody else’—but, oh dear!” cried Alice, with a suddenburst of tears, “I do wish they _would_ put their heads down! I am so_very_ tired of being all alone here!”As she said this she looked down at her hands, and was surprised to seethat she had put on one of the Rabbit’s little white kid gloves whileshe was talking"
79, “How _can_ I have done that?” she thought
80, “I must begrowing small again
81,"” She got up and went to the table to measureherself by it, and found that, as nearly as she could guess, she wasnow about two feet high, and was going on shrinking rapidly: she soonfound out that the cause of this was the fan she was holding, and shedropped it hastily, just in time to avoid shrinking away altogether"
82,"“That _was_ a narrow escape!” said Alice, a good deal frightened at thesudden change, but very glad to find herself still in existence; “andnow for the garden!” and she ran with all speed back to the littledoor: but, alas! the little door was shut again, and the little goldenkey was lying on the glass table as before, “and things are worse thanever,” thought the poor child, “for I never was so small as thisbefore, never! And I declare it’s too bad, that it is!”As she said these words her foot slipped, and in another moment,splash! she was up to her chin in salt water"
83," Her first idea was thatshe had somehow fallen into the sea, “and in that case I can go back byrailway,” she said to herself"
84," (Alice had been to the seaside once inher life, and had come to the general conclusion, that wherever you goto on the English coast you find a number of bathing machines in thesea, some children digging in the sand with wooden spades, then a rowof lodging houses, and behind them a railway station"
85,") However, shesoon made out that she was in the pool of tears which she had wept whenshe was nine feet high"
86,"“I wish I hadn’t cried so much!” said Alice, as she swam about, tryingto find her way out"
87," “I shall be punished for it now, I suppose, bybeing drowned in my own tears! That _will_ be a queer thing, to besure! However, everything is queer to-day"
88,"”Just then she heard something splashing about in the pool a little wayoff, and she swam nearer to make out what it was: at first she thoughtit must be a walrus or hippopotamus, but then she remembered how smallshe was now, and she soon made out that it was only a mouse that hadslipped in like herself"
89,"“Would it be of any use, now,” thought Alice, “to speak to this mouse?Everything is so out-of-the-way down here, that I should think verylikely it can talk: at any rate, there’s no harm in trying"
90,"” So shebegan: “O Mouse, do you know the way out of this pool? I am very tiredof swimming about here, O Mouse!” (Alice thought this must be the rightway of speaking to a mouse: she had never done such a thing before, butshe remembered having seen in her brother’s Latin Grammar, “A mouse—ofa mouse—to a mouse—a mouse—O mouse!”) The Mouse looked at her ratherinquisitively, and seemed to her to wink with one of its little eyes,but it said nothing"
91,"“Perhaps it doesn’t understand English,” thought Alice; “I daresay it’sa French mouse, come over with William the Conqueror"
92,"” (For, with allher knowledge of history, Alice had no very clear notion how long agoanything had happened"
93,) So she began again: “Où est ma chatte?” whichwas the first sentence in her French lesson-book
94," The Mouse gave asudden leap out of the water, and seemed to quiver all over withfright"
95," “Oh, I beg your pardon!” cried Alice hastily, afraid that shehad hurt the poor animal’s feelings"
96, “I quite forgot you didn’t likecats
97,"”“Not like cats!” cried the Mouse, in a shrill, passionate voice"
98," “Would_you_ like cats if you were me?”“Well, perhaps not,” said Alice in a soothing tone: “don’t be angryabout it"
99, And yet I wish I could show you our cat Dinah: I think you’dtake a fancy to cats if you could only see her
100," She is such a dearquiet thing,” Alice went on, half to herself, as she swam lazily aboutin the pool, “and she sits purring so nicely by the fire, licking herpaws and washing her face—and she is such a nice soft thing tonurse—and she’s such a capital one for catching mice—oh, I beg yourpardon!” cried Alice again, for this time the Mouse was bristling allover, and she felt certain it must be really offended"
101, “We won’t talkabout her any more if you’d rather not
102,"”“We indeed!” cried the Mouse, who was trembling down to the end of histail"
103," “As if _I_ would talk on such a subject! Our family always_hated_ cats: nasty, low, vulgar things! Don’t let me hear the nameagain!”“I won’t indeed!” said Alice, in a great hurry to change the subject ofconversation"
104," “Are you—are you fond—of—of dogs?” The Mouse did notanswer, so Alice went on eagerly: “There is such a nice little dog nearour house I should like to show you! A little bright-eyed terrier, youknow, with oh, such long curly brown hair! And it’ll fetch things whenyou throw them, and it’ll sit up and beg for its dinner, and all sortsof things—I can’t remember half of them—and it belongs to a farmer, youknow, and he says it’s so useful, it’s worth a hundred pounds! He saysit kills all the rats and—oh dear!” cried Alice in a sorrowful tone,“I’m afraid I’ve offended it again!” For the Mouse was swimming awayfrom her as hard as it could go, and making quite a commotion in thepool as it went"
105,"So she called softly after it, “Mouse dear! Do come back again, and wewon’t talk about cats or dogs either, if you don’t like them!” When theMouse heard this, it turned round and swam slowly back to her: its facewas quite pale (with passion, Alice thought), and it said in a lowtrembling voice, “Let us get to the shore, and then I’ll tell you myhistory, and you’ll understand why it is I hate cats and dogs"
106,"”It was high time to go, for the pool was getting quite crowded with thebirds and animals that had fallen into it: there were a Duck and aDodo, a Lory and an Eaglet, and several other curious creatures"
107," Aliceled the way, and the whole party swam to the shore"
108,CHAPTER III
109,"A Caucus-Race and a Long TaleThey were indeed a queer-looking party that assembled on the bank—thebirds with draggled feathers, the animals with their fur clinging closeto them, and all dripping wet, cross, and uncomfortable"
110,"The first question of course was, how to get dry again: they had aconsultation about this, and after a few minutes it seemed quitenatural to Alice to find herself talking familiarly with them, as ifshe had known them all her life"
111," Indeed, she had quite a long argumentwith the Lory, who at last turned sulky, and would only say, “I amolder than you, and must know better;” and this Alice would not allowwithout knowing how old it was, and, as the Lory positively refused totell its age, there was no more to be said"
112,"At last the Mouse, who seemed to be a person of authority among them,called out, “Sit down, all of you, and listen to me! _I’ll_ soon makeyou dry enough!” They all sat down at once, in a large ring, with theMouse in the middle"
113," Alice kept her eyes anxiously fixed on it, for shefelt sure she would catch a bad cold if she did not get dry very soon"
114,"“Ahem!” said the Mouse with an important air, “are you all ready? Thisis the driest thing I know"
