Id,text
252,"“Well, I’ve tried to say “How doth the little busy bee,” but it allcame different!” Alice replied in a very melancholy voice"
253,"“Repeat, “_You are old, Father William_,’” said the Caterpillar"
254,"Alice folded her hands, and began:—“You are old, Father William,” the young man said,    “And your hair has become very white;And yet you incessantly stand on your head—    Do you think, at your age, it is right?”“In my youth,” Father William replied to his son,    “I feared it might injure the brain;But, now that I’m perfectly sure I have none,    Why, I do it again and again"
255,"”“You are old,” said the youth, “as I mentioned before,    And have grown most uncommonly fat;Yet you turned a back-somersault in at the door—    Pray, what is the reason of that?”“In my youth,” said the sage, as he shook his grey locks,    “I kept all my limbs very suppleBy the use of this ointment—one shilling the box—    Allow me to sell you a couple?”“You are old,” said the youth, “and your jaws are too weak    For anything tougher than suet;Yet you finished the goose, with the bones and the beak—    Pray, how did you manage to do it?”“In my youth,” said his father, “I took to the law,    And argued each case with my wife;And the muscular strength, which it gave to my jaw,    Has lasted the rest of my life"
256,"”“You are old,” said the youth, “one would hardly suppose    That your eye was as steady as ever;Yet you balanced an eel on the end of your nose—    What made you so awfully clever?”“I have answered three questions, and that is enough,”    Said his father; “don’t give yourself airs!Do you think I can listen all day to such stuff?    Be off, or I’ll kick you down stairs!”“That is not said right,” said the Caterpillar"
257,"“Not _quite_ right, I’m afraid,” said Alice, timidly; “some of thewords have got altered"
258,"”“It is wrong from beginning to end,” said the Caterpillar decidedly,and there was silence for some minutes"
259,The Caterpillar was the first to speak
260,“What size do you want to be?” it asked
261,"“Oh, I’m not particular as to size,” Alice hastily replied; “only onedoesn’t like changing so often, you know"
262,"”“I _don’t_ know,” said the Caterpillar"
263,"Alice said nothing: she had never been so much contradicted in her lifebefore, and she felt that she was losing her temper"
264,“Are you content now?” said the Caterpillar
265,"“Well, I should like to be a _little_ larger, sir, if you wouldn’tmind,” said Alice: “three inches is such a wretched height to be"
266,"”“It is a very good height indeed!” said the Caterpillar angrily,rearing itself upright as it spoke (it was exactly three inches high)"
267,“But I’m not used to it!” pleaded poor Alice in a piteous tone
268," And shethought of herself, “I wish the creatures wouldn’t be so easilyoffended!”“You’ll get used to it in time,” said the Caterpillar; and it put thehookah into its mouth and began smoking again"
269,This time Alice waited patiently until it chose to speak again
270," In aminute or two the Caterpillar took the hookah out of its mouth andyawned once or twice, and shook itself"
271," Then it got down off themushroom, and crawled away in the grass, merely remarking as it went,“One side will make you grow taller, and the other side will make yougrow shorter"
272,”“One side of _what?_ The other side of _what?_” thought Alice toherself
273,"“Of the mushroom,” said the Caterpillar, just as if she had asked italoud; and in another moment it was out of sight"
274,"Alice remained looking thoughtfully at the mushroom for a minute,trying to make out which were the two sides of it; and as it wasperfectly round, she found this a very difficult question"
275," However, atlast she stretched her arms round it as far as they would go, and brokeoff a bit of the edge with each hand"
276,"“And now which is which?” she said to herself, and nibbled a little ofthe right-hand bit to try the effect: the next moment she felt aviolent blow underneath her chin: it had struck her foot!She was a good deal frightened by this very sudden change, but she feltthat there was no time to be lost, as she was shrinking rapidly; so sheset to work at once to eat some of the other bit"
277," Her chin was pressedso closely against her foot, that there was hardly room to open hermouth; but she did it at last, and managed to swallow a morsel of thelefthand bit"
278,"*      *      *      *      *      *      *    *      *      *      *      *      **      *      *      *      *      *      *“Come, my head’s free at last!” said Alice in a tone of delight, whichchanged into alarm in another moment, when she found that her shoulderswere nowhere to be found: all she could see, when she looked down, wasan immense length of neck, which seemed to rise like a stalk out of asea of green leaves that lay far below her"
279,“What _can_ all that green stuff be?” said Alice
280," “And where _have_ myshoulders got to? And oh, my poor hands, how is it I can’t see you?”She was moving them about as she spoke, but no result seemed to follow,except a little shaking among the distant green leaves"
281,"As there seemed to be no chance of getting her hands up to her head,she tried to get her head down to them, and was delighted to find thather neck would bend about easily in any direction, like a serpent"
282," Shehad just succeeded in curving it down into a graceful zigzag, and wasgoing to dive in among the leaves, which she found to be nothing butthe tops of the trees under which she had been wandering, when a sharphiss made her draw back in a hurry: a large pigeon had flown into herface, and was beating her violently with its wings"
283,“Serpent!” screamed the Pigeon
284,“I’m _not_ a serpent!” said Alice indignantly
285," “Let me alone!”“Serpent, I say again!” repeated the Pigeon, but in a more subduedtone, and added with a kind of sob, “I’ve tried every way, and nothingseems to suit them!”“I haven’t the least idea what you’re talking about,” said Alice"
286,"“I’ve tried the roots of trees, and I’ve tried banks, and I’ve triedhedges,” the Pigeon went on, without attending to her; “but thoseserpents! There’s no pleasing them!”Alice was more and more puzzled, but she thought there was no use insaying anything more till the Pigeon had finished"
287,"“As if it wasn’t trouble enough hatching the eggs,” said the Pigeon;“but I must be on the look-out for serpents night and day! Why, Ihaven’t had a wink of sleep these three weeks!”“I’m very sorry you’ve been annoyed,” said Alice, who was beginning tosee its meaning"
288,"“And just as I’d taken the highest tree in the wood,” continued thePigeon, raising its voice to a shriek, “and just as I was thinking Ishould be free of them at last, they must needs come wriggling downfrom the sky! Ugh, Serpent!”“But I’m _not_ a serpent, I tell you!” said Alice"
289, “I’m a—I’m a—”“Well! _What_ are you?” said the Pigeon
290," “I can see you’re trying toinvent something!”“I—I’m a little girl,” said Alice, rather doubtfully, as she rememberedthe number of changes she had gone through that day"
291,“A likely story indeed!” said the Pigeon in a tone of the deepestcontempt
292," “I’ve seen a good many little girls in my time, but never_one_ with such a neck as that! No, no! You’re a serpent; and there’sno use denying it"
293," I suppose you’ll be telling me next that you nevertasted an egg!”“I _have_ tasted eggs, certainly,” said Alice, who was a very truthfulchild; “but little girls eat eggs quite as much as serpents do, youknow"
294,"”“I don’t believe it,” said the Pigeon; “but if they do, why thenthey’re a kind of serpent, that’s all I can say"
295,"”This was such a new idea to Alice, that she was quite silent for aminute or two, which gave the Pigeon the opportunity of adding, “You’relooking for eggs, I know _that_ well enough; and what does it matter tome whether you’re a little girl or a serpent?”“It matters a good deal to _me_,” said Alice hastily; “but I’m notlooking for eggs, as it happens; and if I was, I shouldn’t want_yours_: I don’t like them raw"
296,"”“Well, be off, then!” said the Pigeon in a sulky tone, as it settleddown again into its nest"
297," Alice crouched down among the trees as wellas she could, for her neck kept getting entangled among the branches,and every now and then she had to stop and untwist it"
298," After a whileshe remembered that she still held the pieces of mushroom in her hands,and she set to work very carefully, nibbling first at one and then atthe other, and growing sometimes taller and sometimes shorter, untilshe had succeeded in bringing herself down to her usual height"
299,"It was so long since she had been anything near the right size, that itfelt quite strange at first; but she got used to it in a few minutes,and began talking to herself, as usual"
300," “Come, there’s half my plandone now! How puzzling all these changes are! I’m never sure what I’mgoing to be, from one minute to another! However, I’ve got back to myright size: the next thing is, to get into that beautiful garden—how_is_ that to be done, I wonder?” As she said this, she came suddenlyupon an open place, with a little house in it about four feet high"
301,"“Whoever lives there,” thought Alice, “it’ll never do to come upon them_this_ size: why, I should frighten them out of their wits!” So shebegan nibbling at the righthand bit again, and did not venture to gonear the house till she had brought herself down to nine inches high"
302,CHAPTER VI
303,"Pig and PepperFor a minute or two she stood looking at the house, and wondering whatto do next, when suddenly a footman in livery came running out of thewood—(she considered him to be a footman because he was in livery:otherwise, judging by his face only, she would have called him afish)—and rapped loudly at the door with his knuckles"
304," It was opened byanother footman in livery, with a round face, and large eyes like afrog; and both footmen, Alice noticed, had powdered hair that curledall over their heads"
305," She felt very curious to know what it was allabout, and crept a little way out of the wood to listen"
306,"The Fish-Footman began by producing from under his arm a great letter,nearly as large as himself, and this he handed over to the other,saying, in a solemn tone, “For the Duchess"
307, An invitation from theQueen to play croquet
308,"” The Frog-Footman repeated, in the same solemntone, only changing the order of the words a little, “From the Queen"
309,An invitation for the Duchess to play croquet
310,"”Then they both bowed low, and their curls got entangled together"
311,"Alice laughed so much at this, that she had to run back into the woodfor fear of their hearing her; and when she next peeped out theFish-Footman was gone, and the other was sitting on the ground near thedoor, staring stupidly up into the sky"
312,"Alice went timidly up to the door, and knocked"
313,"“There’s no sort of use in knocking,” said the Footman, “and that fortwo reasons"
314," First, because I’m on the same side of the door as youare; secondly, because they’re making such a noise inside, no one couldpossibly hear you"
315,"” And certainly there _was_ a most extraordinarynoise going on within—a constant howling and sneezing, and every nowand then a great crash, as if a dish or kettle had been broken topieces"
316,"“Please, then,” said Alice, “how am I to get in?”“There might be some sense in your knocking,” the Footman went onwithout attending to her, “if we had the door between us"
317," For instance,if you were _inside_, you might knock, and I could let you out, youknow"
318,"” He was looking up into the sky all the time he was speaking, andthis Alice thought decidedly uncivil"
319," “But perhaps he can’t help it,”she said to herself; “his eyes are so _very_ nearly at the top of hishead"
320, But at any rate he might answer questions
321,"—How am I to get in?”she repeated, aloud"
322,"“I shall sit here,” the Footman remarked, “till tomorrow—”At this moment the door of the house opened, and a large plate cameskimming out, straight at the Footman’s head: it just grazed his nose,and broke to pieces against one of the trees behind him"
323,"“—or next day, maybe,” the Footman continued in the same tone, exactlyas if nothing had happened"
324,"“How am I to get in?” asked Alice again, in a louder tone"
325,“_Are_ you to get in at all?” said the Footman
326," “That’s the firstquestion, you know"
327,"”It was, no doubt: only Alice did not like to be told so"
328," “It’s reallydreadful,” she muttered to herself, “the way all the creatures argue"
329,"It’s enough to drive one crazy!”The Footman seemed to think this a good opportunity for repeating hisremark, with variations"
330," “I shall sit here,” he said, “on and off, fordays and days"
331,”“But what am _I_ to do?” said Alice
332,"“Anything you like,” said the Footman, and began whistling"
333,"“Oh, there’s no use in talking to him,” said Alice desperately: “he’sperfectly idiotic!” And she opened the door and went in"
334,"The door led right into a large kitchen, which was full of smoke fromone end to the other: the Duchess was sitting on a three-legged stoolin the middle, nursing a baby; the cook was leaning over the fire,stirring a large cauldron which seemed to be full of soup"
335,"“There’s certainly too much pepper in that soup!” Alice said toherself, as well as she could for sneezing"
336,There was certainly too much of it in the air
337," Even the Duchess sneezedoccasionally; and as for the baby, it was sneezing and howlingalternately without a moment’s pause"
338," The only things in the kitchenthat did not sneeze, were the cook, and a large cat which was sittingon the hearth and grinning from ear to ear"
339,"“Please would you tell me,” said Alice, a little timidly, for she wasnot quite sure whether it was good manners for her to speak first, “whyyour cat grins like that?”“It’s a Cheshire cat,” said the Duchess, “and that’s why"
340," Pig!”She said the last word with such sudden violence that Alice quitejumped; but she saw in another moment that it was addressed to thebaby, and not to her, so she took courage, and went on again:—“I didn’t know that Cheshire cats always grinned; in fact, I didn’tknow that cats _could_ grin"
341,"”“They all can,” said the Duchess; “and most of ’em do"
342,"”“I don’t know of any that do,” Alice said very politely, feeling quitepleased to have got into a conversation"
343,"“You don’t know much,” said the Duchess; “and that’s a fact"
344,"”Alice did not at all like the tone of this remark, and thought it wouldbe as well to introduce some other subject of conversation"
345," While shewas trying to fix on one, the cook took the cauldron of soup off thefire, and at once set to work throwing everything within her reach atthe Duchess and the baby—the fire-irons came first; then followed ashower of saucepans, plates, and dishes"
346," The Duchess took no notice ofthem even when they hit her; and the baby was howling so much already,that it was quite impossible to say whether the blows hurt it or not"
347,"“Oh, _please_ mind what you’re doing!” cried Alice, jumping up and downin an agony of terror"
348," “Oh, there goes his _precious_ nose!” as anunusually large saucepan flew close by it, and very nearly carried itoff"
349,"“If everybody minded their own business,” the Duchess said in a hoarsegrowl, “the world would go round a deal faster than it does"
350,"”“Which would _not_ be an advantage,” said Alice, who felt very glad toget an opportunity of showing off a little of her knowledge"
351," “Justthink of what work it would make with the day and night! You see theearth takes twenty-four hours to turn round on its axis—”“Talking of axes,” said the Duchess, “chop off her head!”Alice glanced rather anxiously at the cook, to see if she meant to takethe hint; but the cook was busily stirring the soup, and seemed not tobe listening, so she went on again: “Twenty-four hours, I _think_; oris it twelve? I—”“Oh, don’t bother _me_,” said the Duchess; “I never could abidefigures!” And with that she began nursing her child again, singing asort of lullaby to it as she did so, and giving it a violent shake atthe end of every line:“Speak roughly to your little boy,    And beat him when he sneezes:He only does it to annoy,    Because he knows it teases"
352,”CHORUS
353,"(In which the cook and the baby joined):“Wow! wow! wow!”While the Duchess sang the second verse of the song, she kept tossingthe baby violently up and down, and the poor little thing howled so,that Alice could hardly hear the words:—“I speak severely to my boy,    I beat him when he sneezes;For he can thoroughly enjoy    The pepper when he pleases!”CHORUS"
354,"“Wow! wow! wow!”“Here! you may nurse it a bit, if you like!” the Duchess said to Alice,flinging the baby at her as she spoke"
355," “I must go and get ready to playcroquet with the Queen,” and she hurried out of the room"
356," The cookthrew a frying-pan after her as she went out, but it just missed her"
357,"Alice caught the baby with some difficulty, as it was a queer-shapedlittle creature, and held out its arms and legs in all directions,“just like a star-fish,” thought Alice"
358," The poor little thing wassnorting like a steam-engine when she caught it, and kept doublingitself up and straightening itself out again, so that altogether, forthe first minute or two, it was as much as she could do to hold it"
359,"As soon as she had made out the proper way of nursing it, (which was totwist it up into a sort of knot, and then keep tight hold of its rightear and left foot, so as to prevent its undoing itself,) she carried itout into the open air"
360," “If I don’t take this child away with me,”thought Alice, “they’re sure to kill it in a day or two: wouldn’t it bemurder to leave it behind?” She said the last words out loud, and thelittle thing grunted in reply (it had left off sneezing by this time)"
361,"“Don’t grunt,” said Alice; “that’s not at all a proper way ofexpressing yourself"
362,"”The baby grunted again, and Alice looked very anxiously into its faceto see what was the matter with it"
363," There could be no doubt that it hada _very_ turn-up nose, much more like a snout than a real nose; alsoits eyes were getting extremely small for a baby: altogether Alice didnot like the look of the thing at all"
364," “But perhaps it was onlysobbing,” she thought, and looked into its eyes again, to see if therewere any tears"
365,"No, there were no tears"
366," “If you’re going to turn into a pig, my dear,”said Alice, seriously, “I’ll have nothing more to do with you"
367," Mindnow!” The poor little thing sobbed again (or grunted, it was impossibleto say which), and they went on for some while in silence"
368,"Alice was just beginning to think to herself, “Now, what am I to dowith this creature when I get it home?” when it grunted again, soviolently, that she looked down into its face in some alarm"
369," This timethere could be _no_ mistake about it: it was neither more nor less thana pig, and she felt that it would be quite absurd for her to carry itfurther"
370,"So she set the little creature down, and felt quite relieved to see ittrot away quietly into the wood"
371," “If it had grown up,” she said toherself, “it would have made a dreadfully ugly child: but it makesrather a handsome pig, I think"
372,"” And she began thinking over otherchildren she knew, who might do very well as pigs, and was just sayingto herself, “if one only knew the right way to change them—” when shewas a little startled by seeing the Cheshire Cat sitting on a bough ofa tree a few yards off"
373,The Cat only grinned when it saw Alice
374," It looked good-natured, shethought: still it had _very_ long claws and a great many teeth, so shefelt that it ought to be treated with respect"
375,"“Cheshire Puss,” she began, rather timidly, as she did not at all knowwhether it would like the name: however, it only grinned a littlewider"
376," “Come, it’s pleased so far,” thought Alice, and she went on"
377,"“Would you tell me, please, which way I ought to go from here?”“That depends a good deal on where you want to get to,” said the Cat"
378,“I don’t much care where—” said Alice
379,"“Then it doesn’t matter which way you go,” said the Cat"
380,"“—so long as I get _somewhere_,” Alice added as an explanation"
381,"“Oh, you’re sure to do that,” said the Cat, “if you only walk longenough"
382,"”Alice felt that this could not be denied, so she tried anotherquestion"
383," “What sort of people live about here?”“In _that_ direction,” the Cat said, waving its right paw round, “livesa Hatter: and in _that_ direction,” waving the other paw, “lives aMarch Hare"
384, Visit either you like: they’re both mad
385,"”“But I don’t want to go among mad people,” Alice remarked"
386,"“Oh, you can’t help that,” said the Cat: “we’re all mad here"
387, I’m mad
388,You’re mad
389,”“How do you know I’m mad?” said Alice
390,"“You must be,” said the Cat, “or you wouldn’t have come here"
391,"”Alice didn’t think that proved it at all; however, she went on “And howdo you know that you’re mad?”“To begin with,” said the Cat, “a dog’s not mad"
392," You grant that?”“I suppose so,” said Alice"
393,"“Well, then,” the Cat went on, “you see, a dog growls when it’s angry,and wags its tail when it’s pleased"
394," Now _I_ growl when I’m pleased,and wag my tail when I’m angry"
395, Therefore I’m mad
396,"”“_I_ call it purring, not growling,” said Alice"
397,"“Call it what you like,” said the Cat"
398," “Do you play croquet with theQueen to-day?”“I should like it very much,” said Alice, “but I haven’t been invitedyet"
399,"”“You’ll see me there,” said the Cat, and vanished"
400,"Alice was not much surprised at this, she was getting so used to queerthings happening"
401," While she was looking at the place where it had been,it suddenly appeared again"
402,"“By-the-bye, what became of the baby?” said the Cat"
403, “I’d nearlyforgotten to ask
404,"”“It turned into a pig,” Alice quietly said, just as if it had come backin a natural way"
405,"“I thought it would,” said the Cat, and vanished again"
406,"Alice waited a little, half expecting to see it again, but it did notappear, and after a minute or two she walked on in the direction inwhich the March Hare was said to live"
407," “I’ve seen hatters before,” shesaid to herself; “the March Hare will be much the most interesting, andperhaps as this is May it won’t be raving mad—at least not so mad as itwas in March"
408,"” As she said this, she looked up, and there was the Catagain, sitting on a branch of a tree"
409,"“Did you say pig, or fig?” said the Cat"
410,"“I said pig,” replied Alice; “and I wish you wouldn’t keep appearingand vanishing so suddenly: you make one quite giddy"
411,"”“All right,” said the Cat; and this time it vanished quite slowly,beginning with the end of the tail, and ending with the grin, whichremained some time after the rest of it had gone"
412,"“Well! I’ve often seen a cat without a grin,” thought Alice; “but agrin without a cat! It’s the most curious thing I ever saw in my life!”She had not gone much farther before she came in sight of the house ofthe March Hare: she thought it must be the right house, because thechimneys were shaped like ears and the roof was thatched with fur"
413," Itwas so large a house, that she did not like to go nearer till she hadnibbled some more of the lefthand bit of mushroom, and raised herselfto about two feet high: even then she walked up towards it rathertimidly, saying to herself “Suppose it should be raving mad after all!I almost wish I’d gone to see the Hatter instead!”CHAPTER VII"
414,"A Mad Tea-PartyThere was a table set out under a tree in front of the house, and theMarch Hare and the Hatter were having tea at it: a Dormouse was sittingbetween them, fast asleep, and the other two were using it as acushion, resting their elbows on it, and talking over its head"
415," “Veryuncomfortable for the Dormouse,” thought Alice; “only, as it’s asleep,I suppose it doesn’t mind"
416,"”The table was a large one, but the three were all crowded together atone corner of it: “No room! No room!” they cried out when they sawAlice coming"
417," “There’s _plenty_ of room!” said Alice indignantly, andshe sat down in a large arm-chair at one end of the table"
418,"“Have some wine,” the March Hare said in an encouraging tone"
419,"Alice looked all round the table, but there was nothing on it but tea"
420,"“I don’t see any wine,” she remarked"
421,"“There isn’t any,” said the March Hare"
422,"“Then it wasn’t very civil of you to offer it,” said Alice angrily"
423,"“It wasn’t very civil of you to sit down without being invited,” saidthe March Hare"
